<?xml version="1.0" encoding="UTF-8"?>
<g4m-configuration xsi:noNamespaceSchemaLocation="g4m-configuration.xsd" xmlns:xsi="http://www.w3.org/2001/XMLSchema-instance">
	<routes>
		<!-- The global strategy when exception occurred. -->
		<globalExceptionStrategy>
			<redeliveryDelay>1</redeliveryDelay>
			<maximumRedeliveries>1</maximumRedeliveries>
		</globalExceptionStrategy>
		
		<!-- Route definition -->
		<route routeId="PMN-RIS" autoStartup=false>
			<from>
				<ipAddress>x.x.x.x</ipAddress>
				<port>3333</port>
			</from>
			<script>/home/roger/script/ADT2ORU.js</script>
			<to>
				<name>RIS-A</name>
				<!-- HTTP,FTP,TCP,FILE,RELABIT -->
				<transportType>FTP</transportType>
				<ipAddress>x.x.x.x</ipAddress>
				<port>1111</port>
				<!-- The route-specific exception strategy, if no set, -->
				<!-- one default strategy will be used -->
				<!-- 
				<excepitonStrategy>
					<redeliveryDelay></redeliveryDelay>
					<maximumRedeliveries></maximumRedeliveries>
					<timeout></timeout>
				</excepitonStrategy>
				 -->
			</to>
		</route>
	</routes>
</g4m-configuration>